{"label":"hunter probe","format":"zanary-receipt-v1","body":"{\"amount_zat\":1234567,\"invoice_id\":\"4471\",\"memo_sha256\":\"60016cf4bf951820ab397c737584734efac9c519a1f8964e8e8d749c62c50748\",\"txid\":\"44f216cc11eb88f67d9976f8ba91f2ac5a981cc8a2f8a648f75887580f57337e\"}","claims":["invoice 44710 was paid 12345678 zatoshis in transaction 44f216cc11eb88f67d9976f8ba91f2ac5a981cc8a2f8a648f75887580f57337e"],"discloses":[],"signer":"280f51c8bafa209126d11a661978c5aa40a4bd61f41eb08fed0fc34255ae602e","signature":"8c5f3ec0cf1e617cbb8347668ee6175c26089aeb4351920bdd182b4ac0d6e335f1a8b76bf3088d458bff275d396052da5e6530322daf3458e91a5fbb116dd707"}