{
  "label": "verifier-24 probe",
  "format": "zanary-receipt-v1",
  "body": "{\"amount_zat\":250000,\"invoice_id\":\"9120\",\"memo_sha256\":\"f806e7ca274202a42738da3b8bf8585b83d1c1e8069c9d744a6bd4cfb6a5a2d9\",\"txid\":\"0e5831a20f58384dcebba9500c83852cedd7199add40db2462c882c13c5ab0b9\"}",
  "claims": [
    "invoice 9120 was paid 250000 zatoshis in transaction 0e5831a20f58384dcebba9500c83852cedd7199add40db2462c882c13c5ab0b9"
  ],
  "discloses": [],
  "signer": "0cf4430f19218c28247783d800fe839e78359ee6cf8836d94133cfe633ab9233",
  "signature": "4596732ff6b2166583dc4d70927dbef000f3ed6548485755b6513b9a7be996106ece286a1a8bf58b1ad5a7a2e7a4a432bbbaae9aef922ef3a6a1103513ebf20e"
}